{
  "version": "1.0",
  "style_playbook": "crime-ledger",
  "scenes": [
    {
      "id": "scene_01",
      "type": "generated",
      "description": "February first, 2009. Jeju Island. A childcare teacher boards a taxi at three AM.",
      "start_seconds": 0.0,
      "end_seconds": 6.2,
      "duration_seconds": 6.2,
      "script_section_id": "scene_01",
      "shot_type": "body_kenburns",
      "image_prompt": "rain-soaked Jeju street at 3 AM, taxi pulling away, empty road, monochrome noir, film grain",
      "stock_search_query": "Jeju Island empty street night taxi",
      "narrative_role": "establish_context",
      "information_role": "Scene 1 of 90: February first, 2009. Jeju Island. A childcare teacher boards a taxi at three AM..."
    },
    {
      "id": "scene_02",
      "type": "generated",
      "description": "She calls a taxi through directory service. That is the last confirmed trace of her alive.",
      "start_seconds": 6.2,
      "end_seconds": 11.68,
      "duration_seconds": 5.48,
      "script_section_id": "scene_02",
      "shot_type": "body_kenburns",
      "image_prompt": "taxi dispatch phone, hand pressing numbers, dim screen glow, forensic document, monochrome",
      "stock_search_query": null,
      "narrative_role": "deliver_payload",
      "information_role": "Scene 2 of 90: She calls a taxi through directory service. That is the last confirmed trace of ..."
    },
    {
      "id": "scene_03",
      "type": "generated",
      "description": "The taxi arrives. She gets in. The meter activates. She never reaches home.",
      "start_seconds": 11.68,
      "end_seconds": 17.0,
      "duration_seconds": 5.32,
      "script_section_id": "scene_03",
      "shot_type": "body_kenburns",
      "image_prompt": "taxi interior rear seat, empty passenger view, rain streaks, clinical monochrome",
      "stock_search_query": null,
      "narrative_role": "deliver_payload",
      "information_role": "Scene 3 of 90: The taxi arrives. She gets in. The meter activates. She never reaches home...."
    },
    {
      "id": "scene_04",
      "type": "generated",
      "description": "Her family reports her missing after six days. A bag appears. Her wallet. Her phone.",
      "start_seconds": 17.0,
      "end_seconds": 22.88,
      "duration_seconds": 5.88,
      "script_section_id": "scene_04",
      "shot_type": "body_kenburns",
      "image_prompt": "evidence bag with wallet and phone, chain of custody, forensic table, monochrome",
      "stock_search_query": null,
      "narrative_role": "deliver_payload",
      "information_role": "Scene 4 of 90: Her family reports her missing after six days. A bag appears. Her wallet. Her ph..."
    },
    {
      "id": "scene_05",
      "type": "generated",
      "description": "Seven days later, a farmer finds her in a drainage ditch near Aewol. Top only.",
      "start_seconds": 22.88,
      "end_seconds": 28.36,
      "duration_seconds": 5.48,
      "script_section_id": "scene_05",
      "shot_type": "body_kenburns",
      "image_prompt": "empty drainage ditch, bare earth, overcast sky, forensic marker, clinical restraint",
      "stock_search_query": null,
      "narrative_role": "deliver_payload",
      "information_role": "Scene 5 of 90: Seven days later, a farmer finds her in a drainage ditch near Aewol. Top only...."
    },
    {
      "id": "scene_06",
      "type": "generated",
      "description": "The autopsy shows ligature marks on her neck. Strangulation. Upper clothing missing. Bruising from struggle.",
      "start_seconds": 28.36,
      "end_seconds": 35.2,
      "duration_seconds": 6.84,
      "script_section_id": "scene_06",
      "shot_type": "body_kenburns",
      "image_prompt": "medical examiner report, neck diagram, ligature mark annotation, monochrome",
      "stock_search_query": null,
      "narrative_role": "deliver_payload",
      "information_role": "Scene 6 of 90: The autopsy shows ligature marks on her neck. Strangulation. Upper clothing miss..."
    },
    {
      "id": "scene_07",
      "type": "generated",
      "description": "But the pathologist estimates death within twenty-four hours of discovery. Not the day she vanished.",
      "start_seconds": 35.2,
      "end_seconds": 40.4,
      "duration_seconds": 5.2,
      "script_section_id": "scene_07",
      "shot_type": "body_kenburns",
      "image_prompt": "autopsy timeline graph, conflicting date arrows, coroner note, clinical monochrome",
      "stock_search_query": null,
      "narrative_role": "deliver_payload",
      "information_role": "Scene 7 of 90: But the pathologist estimates death within twenty-four hours of discovery. Not t..."
    },
    {
      "id": "scene_08",
      "type": "generated",
      "description": "Police canvass five thousand taxi drivers across Jeju. The focus narrows to one man: Park.",
      "start_seconds": 40.4,
      "end_seconds": 46.48,
      "duration_seconds": 6.08,
      "script_section_id": "scene_08",
      "shot_type": "body_kenburns",
      "image_prompt": "taxi driver lineup, five thousand files, suspect photo with red string, monochrome",
      "stock_search_query": null,
      "narrative_role": "deliver_payload",
      "information_role": "Scene 8 of 90: Police canvass five thousand taxi drivers across Jeju. The focus narrows to one ..."
    },
    {
      "id": "scene_09",
      "type": "generated",
      "description": "Park drove a white NF Sonata. CCTV places a matching vehicle near the scene at the critical time.",
      "start_seconds": 46.48,
      "end_seconds": 52.68,
      "duration_seconds": 6.2,
      "script_section_id": "scene_09",
      "shot_type": "body_kenburns",
      "image_prompt": "CCTV still frame, white taxi at intersection, timestamp, red circle annotation",
      "stock_search_query": null,
      "narrative_role": "deliver_payload",
      "information_role": "Scene 9 of 90: Park drove a white NF Sonata. CCTV places a matching vehicle near the scene at t..."
    },
    {
      "id": "scene_10",
      "type": "generated",
      "description": "Analysts find microfibers in Park's taxi. Similar to fur on Lee's jacket. A possible connection.",
      "start_seconds": 52.68,
      "end_seconds": 58.28,
      "duration_seconds": 5.6,
      "script_section_id": "scene_10",
      "shot_type": "body_kenburns",
      "image_prompt": "microscope fiber evidence, jacket texture comparison, forensic document, monochrome",
      "stock_search_query": null,
      "narrative_role": "deliver_payload",
      "information_role": "Scene 10 of 90: Analysts find microfibers in Park's taxi. Similar to fur on Lee's jacket. A poss..."
    },
    {
      "id": "scene_11",
      "type": "generated",
      "description": "But the fibers are mass-produced. The court rules they cannot be uniquely linked to one vehicle.",
      "start_seconds": 58.28,
      "end_seconds": 63.72,
      "duration_seconds": 5.44,
      "script_section_id": "scene_11",
      "shot_type": "body_kenburns",
      "image_prompt": "fiber batch stamp, mass production chart, evidence inconsistency, clinical monochrome",
      "stock_search_query": null,
      "narrative_role": "deliver_payload",
      "information_role": "Scene 11 of 90: But the fibers are mass-produced. The court rules they cannot be uniquely linked..."
    },
    {
      "id": "scene_12",
      "type": "generated",
      "description": "Park deleted phone call records. Suspicious. But deletion alone does not prove murder.",
      "start_seconds": 63.72,
      "end_seconds": 69.2,
      "duration_seconds": 5.48,
      "script_section_id": "scene_12",
      "shot_type": "body_kenburns",
      "image_prompt": "phone call log with gaps, deletion marker, suspicious but inconclusive, monochrome",
      "stock_search_query": null,
      "narrative_role": "deliver_payload",
      "information_role": "Scene 12 of 90: Park deleted phone call records. Suspicious. But deletion alone does not prove m..."
    },
    {
      "id": "scene_13",
      "type": "generated",
      "description": "A blood-stained jean is found in a motel room. The search lacked a warrant. The evidence is suppressed.",
      "start_seconds": 69.2,
      "end_seconds": 75.48,
      "duration_seconds": 6.28,
      "script_section_id": "scene_13",
      "shot_type": "body_kenburns",
      "image_prompt": "illegal search warrant, suppressed evidence stamp, redacted report, monochrome",
      "stock_search_query": null,
      "narrative_role": "deliver_payload",
      "information_role": "Scene 13 of 90: A blood-stained jean is found in a motel room. The search lacked a warrant. The ..."
    },
    {
      "id": "scene_14",
      "type": "generated",
      "description": "Prosecutors rely on circumstantial evidence. No weapon. No DNA. No eyewitness. No direct proof.",
      "start_seconds": 75.48,
      "end_seconds": 83.32,
      "duration_seconds": 7.84,
      "script_section_id": "scene_14",
      "shot_type": "body_kenburns",
      "image_prompt": "evidence table with empty slots, circumstantial cards, clinical restraint, monochrome",
      "stock_search_query": null,
      "narrative_role": "deliver_payload",
      "information_role": "Scene 14 of 90: Prosecutors rely on circumstantial evidence. No weapon. No DNA. No eyewitness. N..."
    },
    {
      "id": "scene_15",
      "type": "generated",
      "description": "The first trial begins in 2019. Ten years after the crime. The family waits. The evidence is weighed.",
      "start_seconds": 83.32,
      "end_seconds": 90.56,
      "duration_seconds": 7.24,
      "script_section_id": "scene_15",
      "shot_type": "body_kenburns",
      "image_prompt": "empty courtroom dock, gavel, ten-year case file, film grain, monochrome",
      "stock_search_query": null,
      "narrative_role": "deliver_payload",
      "information_role": "Scene 15 of 90: The first trial begins in 2019. Ten years after the crime. The family waits. The..."
    },
    {
      "id": "scene_16",